{
  "schemaVersion": 1,
  "description": "Machine-readable record of what has actually been observed to work, as of the evidence cited per entry -- not a claim about what should work. status values: verified (real cluster/host, evidence cited), build-verified (compiles and passes stubbed-runner unit tests only, no real filesystem/cluster exercised), unverified (implemented, never exercised), known-gap (a specific, named blocker exists).",
  "filesystemBackends": [
    {
      "backend": "xfs",
      "status": "verified",
      "evidence": "Air-Gap E2E workflow (.github/workflows/e2e-airgap.yaml): real prjquota-mounted XFS loopback host, quota apply/rolling-upgrade/idempotent-resync and NFSv4 wire-path write rejection verified in CI (#149).",
      "notes": "Primary target filesystem for this project; exercised in the Air-Gap E2E workflow matrix."
    },
    {
      "backend": "ext4",
      "status": "known-gap",
      "evidence": "nfs-quota-agent#4 E2E session: unit tests pass (stubbed CommandRunner), but a real ext4 prjquota mount attempt failed with a kernel error (\"Failed to enable quota tracking (type=2, err=-3, ino=12)\") even after e2fsck -fy on the test host; root cause not diagnosed, session moved to XFS instead.",
      "notes": "Not a known code defect in internal/quota/ext4.go -- the failure was at the mkfs/mount layer of the one test host tried. Needs a second, dedicated attempt on a host confirmed to support ext4 project quota before this can move to verified. PR #155 adds this backend to the Air-Gap E2E matrix; move to verified with the passing run id once that job is green."
    },
    {
      "backend": "btrfs",
      "status": "build-verified",
      "evidence": "Agent Behavior runtime-filesystem-tools check builds the shipped image and verifies the btrfs CLI is present in-container; btrfs CommandRunner unit tests also pass. The previous missing-btrfs-progs container defect was reproduced and repaired in PR #86.",
      "notes": "The image dependency blocker is resolved, but no real Btrfs filesystem E2E exists yet. The target path must already be a subvolume with `btrfs quota enable` configured by the host/operator before this backend can move to verified. PR #155 adds this backend to the Air-Gap E2E matrix; move to verified with the passing run id once that job is green."
    }
  ],
  "architectures": [
    {
      "arch": "linux/amd64",
      "status": "build-verified",
      "evidence": "release.yaml cross-compiles and multi-arch buildx-builds this target on every tagged release; no functional E2E has been run on this architecture."
    },
    {
      "arch": "linux/arm64",
      "status": "verified",
      "evidence": "nfs-quota-agent#4 E2E session ran on Apple Silicon (arm64) via colima -- full agent deploy, quota enforcement, rolling upgrade all observed on this architecture."
    },
    {
      "arch": "linux/arm/v7",
      "status": "build-verified",
      "evidence": "release.yaml cross-compiles and multi-arch buildx-builds this target on every tagged release; no functional E2E has been run on this architecture."
    }
  ],
  "kubernetesVersions": [
    {
      "version": "1.35",
      "distribution": "k3s",
      "status": "verified",
      "evidence": "nfs-quota-agent#4 E2E session (prior to the 1.36 pass documented in the same issue): DaemonSet/PDB/RBAC/CRD/CEL admission all exercised."
    },
    {
      "version": "1.36",
      "distribution": "k3s (v1.36.3+k3s1)",
      "status": "verified",
      "evidence": "nfs-quota-agent#4 E2E session: same coverage as 1.35, plus the DaemonSet+PDB scale-subresource limitation documented there (issues/4 comment)."
    }
  ],
  "knownLimitations": [
    {
      "id": "daemonset-pdb-scale-subresource",
      "summary": "PodDisruptionBudget against a DaemonSet-managed pod fails closed (blocks all Eviction API disruption) on k3s v1.36.3 due to a k8s core limitation (\"daemonsets.apps does not implement the scale subresource\"). helm-upgrade-driven rolling replacement is unaffected -- it does not go through the Eviction API.",
      "evidence": "nfs-quota-agent#4"
    }
  ]
}
